{
  "request_id": "figreq_chart_line_training_curve",
  "paper_id": "figure_agent_chart_demo",
  "figure_id": "fig_chart_line_training_curve",
  "figure_kind": "chart",
  "goal": "Show the training trajectory of Baseline and FigureAgent across optimization steps.",
  "target_section": "Experiments/Training Dynamics",
  "context": {
    "result_summary": "FigureAgent improves faster and reaches a higher final score than the baseline.",
    "method_summary": null,
    "style_profile": "academic_default",
    "output_formats": ["png", "pdf"],
    "max_revision_rounds": 2,
    "chart_type": "line"
  },
  "evidence_refs": [
    {
      "evidence_id": "ev_training_curves",
      "kind": "table_file",
      "path": "test/data/training_curves.csv",
      "content": null,
      "sheet": null,
      "table_name": null,
      "row_selector": null,
      "column_selector": ["step", "method", "score_mean", "score_std"],
      "paragraph_ref": "Experiments/Training Dynamics",
      "sha256": null
    }
  ]
}
