{
  "request_id": "figreq_chart_scatter_cost_performance",
  "paper_id": "figure_agent_chart_demo",
  "figure_id": "fig_chart_scatter_cost_performance",
  "figure_kind": "chart",
  "goal": "Visualize the trade-off between cost proxy and score across routing methods.",
  "target_section": "Experiments/Cost-Performance Trade-off",
  "context": {
    "result_summary": "Hybrid Agent keeps a better score-cost trade-off than rule-only and LLM-only planners.",
    "method_summary": null,
    "style_profile": "academic_default",
    "output_formats": ["png", "pdf"],
    "max_revision_rounds": 2,
    "chart_type": "scatter"
  },
  "evidence_refs": [
    {
      "evidence_id": "ev_cost_performance_scatter",
      "kind": "table_file",
      "path": "test/data/cost_performance_scatter.csv",
      "content": null,
      "sheet": null,
      "table_name": null,
      "row_selector": null,
      "column_selector": ["x", "score_mean", "method", "dataset"],
      "paragraph_ref": "Experiments/Cost-Performance Trade-off",
      "sha256": null
    }
  ]
}
