{
  "request_id": "figreq_chart_bar_ablation",
  "paper_id": "figure_agent_chart_demo",
  "figure_id": "fig_chart_bar_ablation",
  "figure_kind": "chart",
  "goal": "Show the effect of removing key FigureAgent components in an ablation study.",
  "target_section": "Experiments/Ablation Study",
  "context": {
    "result_summary": "The full FigureAgent configuration achieves the highest score among ablations.",
    "method_summary": null,
    "style_profile": "academic_default",
    "output_formats": ["png", "pdf"],
    "max_revision_rounds": 2,
    "chart_type": "bar"
  },
  "evidence_refs": [
    {
      "evidence_id": "ev_ablation_bar",
      "kind": "table_file",
      "path": "test/data/ablation_bar.csv",
      "content": null,
      "sheet": null,
      "table_name": null,
      "row_selector": null,
      "column_selector": ["category", "value"],
      "paragraph_ref": "Experiments/Ablation Study",
      "sha256": null
    }
  ]
}
